<!ELEMENT vms (vm*)>
<!ELEMENT vm (mips,size,ram,bw,cpunum,vmm,status)>
<!ATTLIST vm id ID #REQUIRED >
<!ELEMENT mips (#PCDATA)>
<!ELEMENT size (#PCDATA)>
<!ELEMENT ram (#PCDATA)>
<!ELEMENT bw (#PCDATA)>
<!ELEMENT cpunum (#PCDATA)>
<!ELEMENT vmm (#PCDATA)>
<!ELEMENT status (#PCDATA)>